<xs:schema xmlns:xs="http://www.w3.org/2001/XMLSchema">
    <xs:element name="cards">
        <xs:complexType>
            <xs:sequence>
                <xs:element name="card" maxOccurs="unbounded">
                    <xs:complexType>
                        <xs:sequence>
                            <xs:element name="name" type="xs:string" />
                            <xs:element name="initials">
                                <xs:simpleType>
                                    <xs:restriction base="xs:string">
                                        <xs:pattern value="[a-z] [a-z] [a-z]" />
                                    </xs:restriction>
                                </xs:simpleType>
                            </xs:element>
                            <xs:element name="age" type="xs:integer" />
                        </xs:sequence>
                    </xs:complexType>
                </xs:element>
            </xs:sequence>
        </xs:complexType>
    </xs:element>
</xs:schema>